<?xml version="1.0" encoding="UTF-8"?>
<videoclub xmlns:xsi="http://www.w3.org/2001/XMLSchema-instance" xsi:noNamespaceSchemaLocation = "videoclub.xsd">

       <factura>
            <datos_cliente ident="abcd">
                <nombre>Juan</nombre>
                <apellido>López</apellido>
                <apellido>Jiménez</apellido>
                <dni>11111111N</dni>
                <tfno>123456789</tfno>
            </datos_cliente>
            <datos_factura>
                <resguardo>
                    <forma_pago>
                        Efectivo
                    </forma_pago>
                    <importe_total>
                        1256325.23
                    </importe_total>
                </resguardo>
                <alquileres>
                    <fecha>2010-12-25</fecha>
                    <peliculas>
                        <pelicula id_pelicula="ABC" valoracion="7.1">
                            <titulo>El retorno del Jedi</titulo>
                            <genero>Espacio</genero>
                            <duracion>125</duracion>
                            <actores>
                                <actor>
                                    <nombre>Juan</nombre>
                                    <apellido>Pardo</apellido>
                                    <apellido>López</apellido>
                                </actor>
                                <actor>
                                    <nombre>Manuel</nombre>
                                    <apellido>Bandera</apellido>
                                    <apellido>Garrido</apellido>
                                </actor>
                                <actor>
                                    <nombre>Luis</nombre>
                                    <apellido>González</apellido>
                                    <apellido>Romero</apellido>
                                </actor>
                            </actores>
                        </pelicula>
                    </peliculas>
                </alquileres>
                <compra>
                  <peliculas>
                        <pelicula id_pelicula="ABB" valoracion="9">
                            <titulo>El Señor de los Anillos</titulo>
                            <genero>Fantasia</genero>
                            <duracion>180</duracion>
                            <actores>
                                <actor>
                                    <nombre>persona1</nombre>
                                    <apellido>Ape1</apellido>
                                    <apellido>Ape2</apellido>
                                </actor>
                                <actor>
                                    <nombre>Persona2</nombre>
                                    <apellido>Ape21</apellido>
                                    <apellido>Ape22</apellido>
                                </actor>
                                <actor>
                                    <nombre>Persona3</nombre>
                                    <apellido>Ape31</apellido>
                                    <apellido>Ape32</apellido>
                                </actor>
                            </actores>
                            <fecha_salida>08/07/2008</fecha_salida>
                            <extras/>
                            <formato rebobinada="si">VHS</formato>
                        </pelicula>
                    </peliculas>
                </compra>
            </datos_factura>
       </factura>
       
</videoclub>
